meeting_key	date_ymd	meeting_name	chunk_index	chunk_id	char_start	char_end	text
6be60be53f21	2026-02-03	2026/02/03 18:59 KST에 시작한 회의 - Gemini가 작성한 회의록	5	d49de270f4243b39c68d4de7f61ca6359b18c936	11360	13617	 해야 될 거 같아요. 근데 그렇겠지. 일요일 1일이랑 2일이랑 했었을 때 일요일 날 깃업 작업한 사람 없겠죠?\nIrene Bae: 네.\nJaden Kong: 그러니까\nIrene Bae: 제가 데일리 산출 작업용 시트에서 작업을 하고 오겠습니다.\n \n \n00:13:58\n \nJaden Kong: 네.\nIrene Bae: 어쩐지 오늘 콩님 배경이 좀 달라 가지고 다른데 계시나\nJaden Kong: 음. 거 동생방이에요.\nIrene Bae: 했었는데 아\nJaden Kong: 동생방. 물론 동생도 이거 안 쓰지만. 음.\nIrene Bae: 아님\nJaden Kong: 이제 설거지 해야 돼요. 끝나고. 음. 그리고 집 가야죠.\nIrene Bae: 바쁘시네요.\nJaden Kong: 오늘 바빴어요. 아침에 병원 갔다고. 예.\nIrene Bae: 아. 아, 콩님. 근데 이거 2월 3일 거 자료는 자료가 안\nJaden Kong: 음. 아직 라이브니까 일단 대기.\nIrene Bae: 요.\nJaden Kong: 그러면 아이린 보고할 때 설명을 좀 잘해 주세요. 아직 2월 3일은 업무 진행 중이기 때문에 혹시 2월 3일까지 그 최종본을 공유하고자면 내일 오전에 한번 더 공유하겠다. 오늘은 2월 1일이랑 2월 2일자로 비교한 거여 갖고 사실 변함이 없는 것들이 많다.\n \n \n00:15:17\n \nJaden Kong: 2월 1일이 일요일이다 보니까 그런 설명을 잘 해 줘야 될 거 같아요.\nIrene Bae: 음. 네.\nJaden Kong: 무슨 말인지 아시죠?\nIrene Bae: 네.\nJaden Kong: 예.\nIrene Bae: 노션만 지금 뽑히고 다른 거는 지금 안 뽑히는 거 같아요. 예, 안 뽑혀요. 레코딩 빼고 모션만 뽑히는 거 같아요.\nJaden Kong: 음. 알겠어.\nIrene Bae: 지금 노데이터 found래요.\nJaden Kong: 오케이. 그러면은 K4 슬레네. 이거에 사실은 이렇게 나열되는게 알파벳 순서여 가지고요. 이런 것만 아린 어제 그 대시브 총괄하는 것도 결국은 그냥 숫자 바꿔\nIrene Bae: 네.\nJaden Kong: 주면 땡이거든요.\nIrene Bae: 네.\nJaden Kong: 예. 그럼 제잖아요. 지금 아이님이 보시는 자료가 다 ikln까지잖아요. 그러면요.\nIrene Bae: 네.\nJaden Kong: 여기도 하나만 이렇게 적용해 놓으면요.\n \n \n00:16:18\n \nJaden Kong: 나머지 하나도 바꿔 주면 돼요. 여기가 지금 G4는 고정돼 있고 항상 여기도 i4가 고정돼 있고이 시트에서의 기준은 항상 고정돼 있는데 따라오는 따로는 다른 시트의 정보들이 바뀌는 거잖아요.\nIrene Bae: 네.에에\nJaden Kong: 그게 처음에는 I4고요. J4고요. 그다음 뭐겠어요? 이걸 똑같이 복사했었을 때 Hij K겠죠?\nIrene Bae: 에에\nJaden Kong: 그는 I jk겠죠?\nIrene Bae: 어\nJaden Kong: 순서대로. 예.\nIrene Bae: 아네네\nJaden Kong: 그니까 무지 쉽다는 거예요. 제가 계속 말씀드린다는 건 어려운 예.\nIrene Bae: 아이 정도는 알고 있습니다.네\nJaden Kong: 예. 그렇죠. 그 그러면은 뭐 어려운게 있나요?\nIrene Bae: 네.\nJaden Kong: 저는 이것도 어려웠나 어려워하나 했죠.\nIrene Bae: 아, 콩님 그러면 죠?\nJaden Kong: 그죠? 용신이죠. 자.\n \n \n00:17:10\n \nJaden Kong: 아,\nIrene Bae: 님 이것도 뭐 이것까지?\nJaden Kong: 저는 그래서 어렵다고 하길래 어떤 부분이 어렵지라고 사실은 이런 생각이 사실 들었어요.\nIrene Bae: 아.\nJaden Kong: 솔직히 말씀드렸어요.\nIrene Bae: 아, 저는이 엑셀을 그 뭐지?\nJaden Kong: 예.\nIrene Bae: 아, 제가 이전에 그 외국에 다녔을 때 제가 엑셀을 할 일이 거의 없었어. 왜냐면 이미 세팅된 값이여서 딱 그 어느 부분만 바꾸면 이제 값이 쫙 나오는 형태였거든요.\nJaden Kong: 음.\nIrene Bae: 그 막 예전에 대리 님이나 이런 분들이 다 세팅을 해 놓으셔 가지고 근데 그러다가 이제 여기로 오게 된 거예요,\nJaden Kong: 근데 만약 음 근데\nIrene Bae: 사실. 근데 제 성장은 진짜 여기에 다 있어요.\nJaden Kong: 그 여기서\nIrene Bae: 여기 온더랑 톡감하게.\nJaden Kong: 엑셀을 그 제이스님 같은 분들 엑셀\nIrene Bae: 근데\nJaden Kong: 잘했잖아요. 음.\n \n \n00:17:52
6be60be53f21	2026-02-03	2026/02/03 18:59 KST에 시작한 회의 - Gemini가 작성한 회의록	6	0d7a77eca16e64bf91aecfffa0cec8772b3f4638	13467	15701	 사실. 근데 제 성장은 진짜 여기에 다 있어요.\nJaden Kong: 그 여기서\nIrene Bae: 여기 온더랑 톡감하게.\nJaden Kong: 엑셀을 그 제이스님 같은 분들 엑셀\nIrene Bae: 근데\nJaden Kong: 잘했잖아요. 음.\n \n \n00:17:52\n \nIrene Bae: 아 근데 스님이 보면 잘 가르쳐 주는 스타일이\nJaden Kong: 별로 도움이 안 됐다. 예.\nIrene Bae: 아니에요.\nJaden Kong: 근데 이제 아이린 이제는 그게 안 먹히는 시대인 걸 알잖아요. 그렇죠?\nIrene Bae: 아까도 A한테 물어보면 되죠.\nJaden Kong: AI한테 물어보면 되는 거잖아요. 그렇죠?\nIrene Bae: 근데 물어봤는데 이제 제가 어려운 부분은 이거를 구조학적으로\nJaden Kong: 이제 예.\nIrene Bae: 어떻게 가야 되는지가 어려운 거예요.\nJaden Kong: 어떡해?\nIrene Bae: 근데 그것도 AI한테 물어보면은 답을 주긴 하지만 아 그래도 뭔가 막막하긴 해요, 솔직히.\nJaden Kong: 구조라는게 어떤 구조를 말하는 거예요? 그니까 셀 셀 구조요. 뭐 몇 몇 이런 것들이 헷갈린다는 거예요.\nIrene Bae: 아, 예를 들어 이제 케빈이 뭐 일자별로 그 누자별로 이렇게 한 눈에 보이게이 이런 걸 원하시나 하면서 그런 거를 생각하다가 그러면 이게 너무 막 시티가 길어지고 하는데 이러면서 약간 이제 포화 상태가 오는 거죠.\n \n \n00:19:04\n \nIrene Bae: 하여튼 콩님 저는 솔직히 인정합니다.\nJaden Kong: 음.\nIrene Bae: 전 엑셀에 너무 약한 거 같긴 해요. 근데 이제는 그러면 안 된다는 것도 알고 있습니다. AI가 다 해 주니까 진짜.\nJaden Kong: 뭐 어쨌든 다시 그래서 해 보자면음 1이 그러면요 아리 궁금한 게요.\nIrene Bae: 네.\nJaden Kong: 아 14가 19야 되는 거 아니에요?\nIrene Bae: 14가 아니라 19요.\nJaden Kong: 잘 봐요. 데일리가 아 죄송해요. 죄송해요 죄송해요. 아 95구나.\nIrene Bae: 음.\nJaden Kong: 어 미쳤지 내가. 죄송해요.\nIrene Bae: 네.\nJaden Kong: 쏘리 쏘리.음\nIrene Bae: 아닙니다.이\nJaden Kong: 음.\nIrene Bae: 카운트된 수는 제가 더블 체크 다 했어요.\nJaden Kong: 아, 잠깐만. 아, 내가 머리가 안 돌아네, 지금.\nIrene Bae: 그 그렇다니깐요.\nJaden Kong: 그러면은 여기 있는 시트는 뭐예요, 지금?\n \n \n00:20:32\n \nJaden Kong: 왜 여기는음\nIrene Bae: 이거는 아 콩님 제가 화면 공유를 해 봐도 될까요? 아, 그러니까 그거는이 로데시보드 있잖아요.\nJaden Kong: 예 당겨오는 거잖아요. 그렇죠?음\nIrene Bae: 예, 이거는 각각의 거기 오른쪽에 보면 깃 슬렉 구글 드라이브 미팅 스크립트\nJaden Kong: M.\nIrene Bae: 있잖아요. 저는 그 예를 들어 기시트 한번 보시면은 아래에다가 쭉 붙여 넣어요. 그러니까 2월 3일 거 만약에 뽑으면 2월 3일 날의 기터을 이제 기 시트의 아래에다가 이제 쭉 붙여 넣어요. 그러면 그 깃에 대한 그 데이터 값이 여기 그 누적 대시보드에 알아서 이제 반영이 되는 거예요. 그래서이 누적 대시보드에 있는이 회색칠된 부분은 어 2월 1일부터 앞으로 나올 그 데이터들의 총 값이에요. 그냥 자동으로 이게 함수 적용해 놨어요.\n \n \n00:21:33\n \nJaden Kong: 음 그거는 이해했고요. 지금\nIrene Bae: 네.\nJaden Kong: 제가 지금 착각하고 있던게 있었어요. 나는 계속이 오늘이 값을 계속 2월 3일 값으로 알고 있었던 거야. 계속 생각하고 있었어요. 그러면 안 되는데. 네.\nIrene Bae: Ah.\nJaden Kong: BQ S까지 오케이. 뭐 미디 뭐 바뀐 거 없으니까.\nIrene Bae: 아 미디어 없어요. 다\nJaden Kong: 이로서 그러면은 이제 2월 1일까지의 누적과 2월 1일 2일까지 더해진 2월 2일까지 누적액이 퍼센티지로 나온 거거든요. 재난 제나 님이랑 수연 님이 엄청 늘 노었단 말이야.\nIrene Bae: 네.\nJaden Kong: 그럼 한번 봅시다.\nIrene Bae: 네.\nJaden Kong: 1일 날에서 8,200개 됐으니까 당연히 많이 늘었겠죠.\nIrene Bae: 음.\nJaden Kong: 30개했는데 20개 했으니까. 음.\n \n \n00:23:12
6be60be53f21	2026-02-03	2026/02/03 18:59 KST에 시작한 회의 - Gemini가 작성한 회의록	7	ef8c3ae8fdefe6b72db1742688f850acbcf4db43	15551	18204	ne Bae: 네.\nJaden Kong: 그럼 한번 봅시다.\nIrene Bae: 네.\nJaden Kong: 1일 날에서 8,200개 됐으니까 당연히 많이 늘었겠죠.\nIrene Bae: 음.\nJaden Kong: 30개했는데 20개 했으니까. 음.\n \n \n00:23:12\n \nJaden Kong: 그지? 4,000% 넣은게 맞지? 맞나? 음. 81 아 죄송해요. 죄송해요. 계속 아 이거 옆에 오버롤 차트랑 헷갈린다 지금. 8일씨 4,000% 나와야 되는데.\nIrene Bae: 2월 2일까지 누적이 아니라 2월 2일까지가 지금 총합인 거니까 2월 1일까지의 간만 가지고 해야 되는 건가요? 아닌가? 제가 헷갈리게 해 드렸나?\nJaden Kong: 음, 맞아요. 맞아요. 이거 맞아요. 그 지금 2월 2일까지의 합은 누적이고\nIrene Bae: 네.\nJaden Kong: 여기에서 여기 넣 보는 거예요.\nIrene Bae: 네. 네.\nJaden Kong: 네.이 이 값은 사실이 값이랑 똑같은 거잖아요. 음.\nIrene Bae: 그죠?\nJaden Kong: 그래서 이제 제가 계속 헷갈렸던게이 값이랑 아이 값이랑이 값이랑 같은 건데 계속이 값을 2일까지 죽이 아니라 계속 2월 1일로 생각했어요 제가.\n \n \n00:25:42\n \nIrene Bae: 아 아 아\nJaden Kong: 어 그래서 제가 찐발을 낸 거고요. 그럼 다시 해 봅시다.\nIrene Bae: 아네\nJaden Kong: 이제 항목 평균이라는데요. 그냥 데이 오버데이 어 그로스 누적 그로 누적 아 이런 알 만나 헤더를 아이린 좀 찾아보고 계세요.\nIrene Bae: 누네네네음 음. 이게 그냥 일자별 누적 상승률이라고 하면 안 되잖아요. 전체 누적.\nJaden Kong: 전일 누적 대비 상승률 뭐\nIrene Bae: 음. 어, 디오디 그로스 맞다는데요.\nJaden Kong: 그래요? 그러면\nIrene Bae: 그로스로 계속 추천을 하네요.\nJaden Kong: 되네.\nIrene Bae: 이오디 글로스\nJaden Kong: 음. 잠시만요.\nIrene Bae: S\nJaden Kong: 계단 올게. 아, 예. 오세요, 엄마. Dod요.\nIrene Bae: 네. 디오디\nJaden Kong: 음.\nIrene Bae: 그루스음 선님 그럼 디오디 그로스는 어제 대비 오늘 상승률인 거잖아요.\n \n \n00:28:26\n \nJaden Kong: 어제 누적 대비 오늘 누적 상승 그 저 성장률이라 보면\nIrene Bae: 예.\nJaden Kong: 되죠.\nIrene Bae: 어제 누적 대비 오늘 누적 그럼 만약에 내일 자료를 뽑으면 차 시작부터 3일 동안에 누적된 값의 그 오늘 하는 거죠.\nJaden Kong: 누적값을\nIrene Bae: 그러니까 그냥 어제 대비 오늘이 아니고 어제가 아니라 그동안에 쭉죠.\nJaden Kong: 어제자 스탬프 타임 스탬프가 데일리가 아니라 누적으로 봐야 되는 거죠. 그렇죠? 오늘까지 누적 어제까지 누적 비교한 거니까.\nIrene Bae: 그죠?\nJaden Kong: 네.\nIrene Bae: 응.\nJaden Kong: 음.\nIrene Bae: 아. 응. 응. 하루하루가 아니라\nJaden Kong: 그죠.\nIrene Bae: 누적\nJaden Kong: 그래서 생각해 보니까 그러면 쭈르륵 나열해서 관리를 해야겠다. 장표를. 예. 그래야지 계속 누적을 그날에 맞는 누적 값을 구할 수 있으니까 어 좀\nIrene Bae: 그죠?\nJaden Kong: 번거롭지만 길게 해야 될 거 같아요.\n \n \n00:29:25\n \nIrene Bae: 그 데일리 카운터 시트 가져가는게 맞는 거죠.\nJaden Kong: 음.\nIrene Bae: 공.\nJaden Kong: 음. 근데 보고용은 따로 그냥 보고용을 따로 만들어 주는게 어떨까 싶기도 왜냐면 그냥 보여 줘도 되고 뭐 그렇게 네.\nIrene Bae: 보공은 이거 그냥로 대시보드 누적 지금 이것만 보여 줘도 되지\nJaden Kong: 네. 네.\nIrene Bae: 않나요?\nJaden Kong: 또 어쨌든 오늘 오늘은 설명을 좀 잘 드려야 되었죠. 어 아직 3일 찾게 온전히 누적된 것 어 집게 된 것도 아니고 레코딩도\nIrene Bae: 음.\nJaden Kong: 그렇고 그래서 1월 1일과 1월 2일간의 비교고 1월 1일은 어 공유이었던만큼음 말도 안 되게 그 퍼센테이지가 높은 사람들이 더어 있다. 설명해 주면 돼요. 그죠?\nIrene Bae: Mm.\nJaden Kong: 왜냐면은 진짜 수현님 일요일 날 코드 세 줄 만았는데 어 그다음 날 8,000주 만져 가지고 퍼센티지 엄청 작살났잖아요.음 그죠.\nIrene Bae: 음.\nJaden Kong: 그런 거니까 그렇게 봐야겠네요. 저희가 지금 그 검산을 하고 있어서요. 그것만 끝나면은 될 거 같고 저희 피어리병을 새로 나온 거 있어요?\nIrene Bae: 어, 있어요. 콩님 이거 제가 해 놨어요.\nJaden Kong: 음. 음. 그래요.\nIrene Bae: 리더보드 제가 업데이트 해 놨어요.\nJaden Kong: 음. 으씨. 잠깐만요. 아. 저 왜 안 맞지? 그냥 그렇게 하네. 오늘 임시방편이고요. 음. 아, 잠깐만요. 지 M. 일단 미팅은 이걸로 끝내고 근데 평균값은 제가 좀 찾으려면 오래 걸릴 것 같거든요. 아이린. 음.\nIrene Bae: 네. 네. 아, 네. 네. 네. 네.\n \n \n00:34:16 후 스크립트 작성이 종료되었습니다.
6be60be53f21	2026-02-03	2026/02/03 18:59 KST에 시작한 회의 - Gemini가 작성한 회의록	8	0a72e0bb9ed38b8574cf63b2a0f79d6bd7959bed	18054	18282	. 오늘 임시방편이고요. 음. 아, 잠깐만요. 지 M. 일단 미팅은 이걸로 끝내고 근데 평균값은 제가 좀 찾으려면 오래 걸릴 것 같거든요. 아이린. 음.\nIrene Bae: 네. 네. 아, 네. 네. 네. 네.\n \n \n00:34:16 후 스크립트 작성이 종료되었습니다.\n\n수정 가능한 이 스크립트는 컴퓨터에서 생성되었으며 오류가 포함되어 있을 수 있습니다. 생성 후에도 사용자가 텍스트를 변경할 수 있습니다.
f437a9825c9f	2026-02-04	2026/02/04 15:30 KST에 시작한 회의 - Gemini가 작성한 회의록	0	d5d4f5672ea7d5da9cf77f71ca6840c2aad2c421	0	2139	📝 회의록\n2026년 2월 4일\n회의 일정: 2026년 2월 4일 15:30 KST\n회의 관련 기록 스크립트 녹화 중 \n\n요약\nIrene Bae와 Jaden Kong은 현재 작업 중인 수식의 누적 합계 계산 방식을 확인했으며, Irene Bae의 수식 복잡성에 대한 우려에 Jaden Kong은 데이터를 세로로 누적하고 키워드를 기반으로 합산하는 데이터 관리 방식을 제안했습니다. 또한, Jaden Kong은 DOD 성장률 계산을 'Daily Count' 시트의 좌측 정보를 사용하여 간소화할 수 있으며, 금요일 보고 자료에 집중할 것을 조언했고, Kevin이 AI 토카 네트워크 채널에 올린 메시지에 대해 너무 깊이 고민할 필요는 없다고 언급했습니다. Jaden Kong은 감기에도 불구하고 업무를 지속하고 있으며, Irene Bae에게 DOD 계산 완료 후 Kevin에게 바로 공유해 줄 것을 요청했습니다.\n\n세부정보\n* 수식 및 데이터 누적 논의 Irene Bae는 Jaden Kong에게 현재 작업 중인 수식에 대해 질문하며, 전체 누적 합계에서 이전 날짜의 데일리 카운트를 빼는 방식이 맞는지 확인했고 (00:00:00), Jaden Kong은 그것이 맞다고 확인해 주었습니다 (00:01:30). Irene Bae는 누적 데이터가 늘어날수록 수식이 너무 복잡해지는 것에 대한 우려를 표했고 (00:02:09), Jaden Kong은 데이터를 가로로 펼치는 것보다 세로로 누적하는 것이 더 보기 편할 것이라는 의견을 제시했습니다 (00:02:56).\n* 데이터 관리 방식 제안 Jaden Kong은 데이터 관리 방식에 대한 아이디어를 공유하며, 각자의 데이터를 위에서 아래로 쪼르륵 붙여서 누적하고, 키워드(이름)를 기반으로 숫자를 더하는 방식으로 관리할 것을 제안했습니다 (00:04:27). Jaden Kong은 또한 클라우드 코드에 파일을 밀어 넣어 특정 날짜의 데일리 리포트를 인당 가라 시간만 뽑아내어 붙여넣기만 하면 누적이 계산될 것이라고 설명했습니다 (00:05:16).\n* DOD 성장률 계산 간소화 및 우선순위 조정 Irene Bae가 DOD 성장률 계산 시 일자별 증감도 포함해야 하는지 Kevin이 요청할 수도 있을 것 같다고 언급했지만, Jaden Kong은 금요일 보고 자료만 잘 만들어지면 되므로 과정에 너무 에너지를 소모하지 말 것을 조언했습니다 (00:05:58). Jaden Kong은 DOD 성장률(전일 대비 누적 증감량) 계산 시, 'Daily Count' 시트의 좌측 정보를 이용해 계산을 간소화할 수 있으며 (00:08:47), 굳이 일자별 증감을 추가할 필요는 없다고 말했습니다 (00:05:58).\n* Kevin의 메시지 해석 및 대응 Irene Bae는 Kevin이 AI 토카 네트워크 채널에 프로젝트 해체 가능성을 언급하는 글을 올린 것에 대해 언급했고, Jaden Kong은 Kevin이 충분히 안내했다고 생각하며, 이는 설정 문제일 수도 있고, 알만한 사람에게 예각침을 주는 것일 수도 있으므로 너무 고민할 필요는 없다고 답했습니다 (00:07:17).\n* Jaden Kong의 건강 상태와 업무 처리 Irene Bae는 Jaden Kong의 건강 상태를 염려했고, Jaden Kong은 감기에 걸렸으며 몸살 감기 같다고 답했습니다 (00:11:19). Jaden Kong은 아프지만 쉬지 않고 비타민을 섭취하며 업무를 계속하고 있다고 밝혔고, Irene Bae에게 DOD 계산이 완료되는 대로 Kevin이 3일자도 확인하고 싶어 하므로 바로 공유해 달라고 요청했습니다 (00:11:19).\n\n추천하는 다음 단계\n* Jaden Kong님은 간단한 수식을 사용하여 다른 방식으로 비교할 수 있는 방법을 고민해 볼 것입니다.\n* Irene Bae님은 데일리 카운트의 좌측 정보를 활용하여 DOD 그로스 수식을 새롭게 만들어 볼 것입니다.\n* Irene Bae님은 DOD 관련 내용이 정비되는 대로 Jaden Kong님의 체크 없이 바로 공유해 줄 것입니다.\n\nGemini가 작성한 회의록이 정확한지 검토해야 합니다. Gemini가 회의록을 작성하는 방법에 관한 도움말을 알아보세요.\n회의록 작성 시의 Gemini 사용에 관한 의견을 짧은 설문조사입니다.\n📖 스크립트\n2026년 2월 4일\n회의 일정: 2026년 2월 4일 15:30 KST - 스크립트\n00:00:00
f437a9825c9f	2026-02-04	2026/02/04 15:30 KST에 시작한 회의 - Gemini가 작성한 회의록	1	3aa1a1ff107c37ba8d6474e6f60ba72c7892de8f	1989	4421	검토해야 합니다. Gemini가 회의록을 작성하는 방법에 관한 도움말을 알아보세요.\n회의록 작성 시의 Gemini 사용에 관한 의견을 짧은 설문조사입니다.\n📖 스크립트\n2026년 2월 4일\n회의 일정: 2026년 2월 4일 15:30 KST - 스크립트\n00:00:00\n \nIrene Bae: M.\nJaden Kong: 이리\nIrene Bae: 안녕하세요.\nJaden Kong: 네\nIrene Bae: 님. 저 질문이 있습니다.\nJaden Kong: 예 어떤게 질문일까요?네\nIrene Bae: 이거 관련해서 지금 하고 있었거든요.\nJaden Kong: 네.\nIrene Bae: 근데 저희가 이제 원래 원래 처음에 이제 돼 있었던 거는 기터의 누적이이 전체에서 이제 2월 1일 거를 뺀 거잖아요. 예를 들으면 기터배 데일리 카운트 이거를 뺀 거잖아요.\nJaden Kong: 네.\nIrene Bae: 그러면 이제 오늘은 이제 2월 3일 추가가\nJaden Kong: 음.\nIrene Bae: 됐으니까 2월 이게 2월\nJaden Kong: 네.\nIrene Bae: 1일 거 그다음에 제가 2월 2일 거를 추가한 거거든요.이 합산 금액에서 빠지는게\nJaden Kong: 네.\nIrene Bae: 맞지 않죠.\nJaden Kong: 그러니까 2월 3일까지 더한 총합에서 2월 2일까지 더한 총합을 빼 빼는게 맞죠?\nIrene Bae: 그죠?\nJaden Kong: 예. 음.\nIrene Bae: 그래서 G4 G4 전체에서 지금 그 데일리 카운트에 있는이 요거랑 그다음에 요거를 빼는 거잖아요.\n \n \n00:01:30\n \nJaden Kong: 음. 음.\nIrene Bae: 그죠?\nJaden Kong: 맞습니다.\nIrene Bae: 그죠? 그 제가 하고 있는게 맞나 싶어\nJaden Kong: 예. 잘 접근하셨어요.\nIrene Bae: 가지고\nJaden Kong: 그러니까 1, 2, 3일 합친 거랑 1 2 합친 거를 비교하는 거잖아요.\nIrene Bae: 그죠. 그죠?\nJaden Kong: 그렇죠?\nIrene Bae: 그러니까 전체 누적에 그동안의 누적 누덕까지 오늘 거\nJaden Kong: 그 직전일 누적까지 합이죠. 지금은 사실은 어제 제가 했던 거는요.\nIrene Bae: 빼고네\nJaden Kong: 1일 2 1일 제거 2일밖에 없어 가지고 그냥 단순하게 한 거고요. 아마 이제 단순한 토대다 보니까 아이린이 수정하기로는 계속 뒤에 이제 꼬다리가 붙어 나갈 거예요. 점점 점점.\nIrene Bae: 아\nJaden Kong: 그렇죠. 예.\nIrene Bae: 그죠\nJaden Kong: 그래서 저도 고민인게 어제 근데 제가 어제도 그렇고 지금도 상태가 안 좋거든요.\n \n \n00:02:09\n \nJaden Kong: 근데 고민인게 그게 아니라 그냥 다른 방식으로 간단한 소식으로 그걸 비교할 수 있는 방법이 없을까라는 생각도 들어요.\nIrene Bae: 네.\nJaden Kong: 그래서 근데 어쨌든 이번 주까지는 될 거예요. 어쨌든이 꼬다리 달리는게 막 6일 7일까지는 어떻게 볼 만한데 10일 넘어가 버리면은 뭐 한도 끝도 없어지잖아요.\nIrene Bae: 아, 그러니까요. 콩님.\nJaden Kong: 네.\nIrene Bae: 그래서 사실 제가 어제 좀 해해 봤어요.\nJaden Kong: 네. 아이저를 낸게 있나요?\nIrene Bae: 제 나름대로.\nJaden Kong: 네.\nIrene Bae: 근데 이게 여기 있었나?\nJaden Kong: 예. 음.\nIrene Bae: 어,\nJaden Kong: 사실 공식 자체는 간단합니다.\nIrene Bae: 이건가?\nJaden Kong: 근데 우리가 데이터를 어떻게 정리하고 그 데이터를 어떻게 시겨오냐가 문제인\nIrene Bae: 그 이게 예,\nJaden Kong: 거지.\nIrene Bae: 그 이게 늘어 이게 사실 늘어나면 늘어날수 너무 많아지긴 하거든요.\n \n \n00:02:56\n \nJaden Kong: 음.\nIrene Bae: 근데 이렇게 보는 것도 맞는가 싶어가지고 일단은 어제\nJaden Kong: 아, 근데 저 같은 경우도 하나 사례를 말씀드려 줄게요.\nIrene Bae: 물어 네.\nJaden Kong: 그 잠시만요. 근데 사실이 사람이 책도 아, 아이린 막 옛날에 사각 보면은 막 전화 아래 옵니다 해 갖고 막 상소 이렇게 옆으로 쭉 옆 가로\nIrene Bae: 음.\nJaden Kong: 피잖아요. 근데 그거 겁내 읽기 힘들어 보이잖아요.\nIrene Bae: 예. 끝.\nJaden Kong: 새로로 쫙 내리면서 저희 스마트폰도 그렇고 웹소리나 이런 거 볼 때 스크롤을 위에서 아래로\nIrene Bae: 예.\nJaden Kong: 내리잖아요.\nIrene Bae: 예. 예.\nJaden Kong: 펼쳐지는 정보라면은 사실 카테고리가 더 늘지 않고 고정된 정보인데 히스토리에가 누적된다면 사실 위아래 스크롤이 좀 더 보기 편하긴 할 거예요. 무슨 말인지 알겠죠?\n \n \n00:03:39
