meeting_key	date_ymd	meeting_name	chunk_index	chunk_id	char_start	char_end	text
bf0090d95def	2026-02-02	2026/02/02 13:24 KST에 시작한 회의 - Gemini가 작성한 회의록	0	7737db8246646ab6de8f01c858c4d8cc872535cc	0	2319	📝 회의록\n2026년 2월 2일\n회의 일정: 2026년 2월 2일 13:24 KST\n회의 관련 기록 스크립트 File \n\n요약\nIrene Bae는 Jason Hwang에게 API 키를 확인하고 Claude 코드 설정 명령을 실행하는 과정을 거쳤으며, 태원 님의 지침에 대한 이해 어려움을 표하자 Jason Hwang은 AI 기능이 내장된 편집기 사용과 `export` 명령어를 통한 API 키 설정 방법을 안내했습니다. API 키 유출 및 보안 문제 논의 후 Irene Bae는 Jason Hwang의 안내에 따라 새로운 API 키를 생성하고 터미널 설정을 업데이트했으며, Jason Hwang은 간단한 Python 명령으로 설정을 확인하고 Claude 사용 종료 및 재실행 지침을 설명했습니다.\n\n세부정보\n* API 키 및 Claude 설정 문제 해결 Irene Bae는 Claude 설정을 하는 중에 공유받은 API 키가 올바른지 Jason Hwang에게 문의하며, "시크릿키"로 표시된 세 번째 행의 값이 API 키일 수 있는지 확인했습니다 (00:00:00). Jason Hwang은 Irene Bae가 채팅창에 공유한 시크릿 키가 API 키인 것 같다고 확인했으며 (00:03:26), 이후 Irene Bae는 Jason Hwang의 안내에 따라 해당 키를 사용하여 Claude 코드 설정 명령어를 터미널에서 실행했습니다 (00:07:12).\n* Claude Code 환경 설정 및 사용 지침 Irene Bae는 태원 님의 지침을 따르는 과정에서 "버추얼 키셀렉션 모델"과 같은 내용을 이해하는 데 어려움을 표했고, Jason Hwang은 Antigravity나 Cursor와 같은 AI 기능이 내장된 편집기를 사용하면 복사해서 붙여넣기만 해도 AI가 코드에 대한 설명을 제공해 준다고 조언했습니다 (00:05:05). 또한, Jason Hwang은 터미널에서 `export` 명령어를 사용하여 API 키를 설정하는 구체적인 방법을 안내했는데, Irene Bae는 새로운 탭에서 `export` 명령과 API 토큰을 복사하여 실행하고 (00:07:12), Claude 모델 명령어를 실행하여 설정을 완료했습니다 (00:08:19).\n* 새로운 API 키 생성 및 보안 관련 논의 Irene Bae는 API 키가 유출될 경우 메타마스크 같은 것이 해킹될 수 있는지 문의했고, Jason Hwang은 키가 털리면 폐기하고 새로 만들면 되지만 (00:10:41), API 키가 채팅에 공유될 경우 서버 공격으로 이어져 Kevin에게 추궁당할 가능성은 있다고 언급했습니다 (00:11:29). 이에 따라, Irene Bae는 Jason Hwang의 안내에 따라 새로운 API 키를 생성했습니다. Irene Bae는 키 네임을 적절하게 설정하고 Claude Opus 4.5 모델을 선택하여 새 키를 만들고 (00:12:09), 터미널에서 이전 키를 새 키로 대체하여 `export` 명령어를 다시 실행함으로써 설정을 업데이트했습니다 (00:13:14).\n* 설정 확인 및 추후 사용법 안내 Irene Bae가 새로운 API 키로 설정을 변경한 후, Jason Hwang은 간단한 Python 명령을 실행하여 설정이 성공적으로 완료되었는지 확인했습니다 (00:15:36). Jason Hwang은 Irene Bae가 Claude 사용을 종료하려면 `exit`를 타이핑하면 되고, 다시 실행하려면 터미널에서 Claude 모델 지정 명령어를 입력해야 한다고 안내했습니다 (00:16:47). 그러나 Irene Bae가 다시 Claude를 실행했을 때 "Missing key" 오류가 발생하자, Jason Hwang은 터미널을 나간 후 `source` 명령을 다시 실행하여 설정해야 한다고 설명하며 향후 설정을 쉽게 할 수 있도록 돕겠다고 제안했습니다 (00:17:49).\n\n추천하는 다음 단계\n* Irene Bae님은 워크스페이스 같은 것을 만들어서 그 안에서 클로드 코드 관련 작업을 진행할 것입니다.\n* Irene Bae님은 커서나 안티그라비티 같은 AI 기능이 내장된 편집기를 설치해 볼 것입니다.\n* Irene Bae님은 현재 사용하는 API 키를 폐기하고 Antropic에서 새 API 키를 생성할 것입니다.\n* Jason Hwang님은 Irene Bae님에게 클로드 코드 설정을 편리하게 할 수 있도록 설정을 해 줄 것입니다.\n\nGemini가 작성한 회의록이 정확한지 검토해야 합니다. Gemini가 회의록을 작성하는 방법에 관한 도움말을 알아보세요.\n회의록 작성 시의 Gemini 사용에 관한 의견을 짧은 설문조사입니다.\n📖 스크립트\n2026년 2월 2일\n회의 일정: 2026년 2월 2일 13:24 KST - 스크립트\n00:00:00
bf0090d95def	2026-02-02	2026/02/02 13:24 KST에 시작한 회의 - Gemini가 작성한 회의록	1	2c57d45f178b0a33b180165065fd5a563f735f07	2169	4723	검토해야 합니다. Gemini가 회의록을 작성하는 방법에 관한 도움말을 알아보세요.\n회의록 작성 시의 Gemini 사용에 관한 의견을 짧은 설문조사입니다.\n📖 스크립트\n2026년 2월 2일\n회의 일정: 2026년 2월 2일 13:24 KST - 스크립트\n00:00:00\n \nJason Hwang: 네.\nIrene Bae: 선님 안녕하세요.\nJason Hwang: 안녕하세요.\nIrene Bae: 안녕하세요.\nJason Hwang: 안녕하세요.\nIrene Bae: 네.\nJason Hwang: 네.\nIrene Bae: 저 다른게 아니라 그 API 키를 공유를 해 주셨는데\nJason Hwang: 네. 네.\nIrene Bae: 잠시만요.음\nJason Hwang: 네.\nIrene Bae: 공유를 해 보겠습니다. 혹시 잘 보이실까요?\nJason Hwang: 음. 네.\nIrene Bae: 네.\nJason Hwang: 잠시만요.\nIrene Bae: 그 케빈이 그 저랑 제이드 님도 다 그 뭐지?\nJason Hwang: 네.\nIrene Bae: 클로드 클로드 세팅 해 놓으라고 하셔 가지고 지금 하는\nJason Hwang: 음. 네. 네.\nIrene Bae: 중인데 API 키를 받았는데이 키 API 키가 혹시 이거일까요?\nJason Hwang: 어, 저기 시크릿키라고 돼 있는 부분이 있죠?\nIrene Bae: 시클 키 아 이거요?\nJason Hwang: 세 번째 행이거든요. 네. 네. 그게 저게 바로 안 보일 텐데 예전에 받은 거 있지 않으세요?\nIrene Bae: 네.\nJason Hwang: 아니면 그 그냥 이렇게만 알려줬어요.\nIrene Bae: 그냥 링크로만 주셨거든요.\n \n \n00:01:59\n \nIrene Bae: 링크로만. 그래서 이거 요렇게 딱 들어가니까 그냥 요렇게만 보이더라고요.\nJason Hwang: 네.\nIrene Bae: 링크로 주신게요\nJason Hwang: 어.\nIrene Bae: 페이지더라고요.\nJason Hwang: 아. 아 저 저런 것도 잘 잠시만요.\nIrene Bae: 네.\nJason Hwang: 그래서\nIrene Bae: 아니 여기 API 레퍼런스\nJason Hwang: 잠시만 저기 원래 시크리키 같은게 뭐 복사가 되나요? 아니면 그 클릭 같은게 되나요?\nIrene Bae: 제가 한번 이거 복사해서 메모에 한번 붙여 놔 볼게요.\nJason Hwang: 네.\nIrene Bae: 어 어 지금 제가 채팅창에 쳤는데 그냥 저거 그냥 이거 자체만 그냥 복사되는 거 같아요. 그 풀 키가 아닌 거 같은데. 아니면 아니면 여기 이렇게 누르면은\nJason Hwang: 음.\nIrene Bae: 이런 거 뜨거든요.\nJason Hwang: 아, 아니요. 그거랑은 상관없어요. 그건 상관없었고. 잠시만요. 저도 확인해 볼게요. 팅은 있고\nIrene Bae: 네.\n \n \n00:03:26\n \nJason Hwang: 음. 아, 저렇게 접속하시면은 크리에이트 유키 해 가지고 만들 수가 있는 걸\nIrene Bae: 아. 어.\nJason Hwang: 같거든요.\nIrene Bae: 스님.\nJason Hwang: 네.\nIrene Bae: 저 이거 같아요.\nJason Hwang: 네.\nIrene Bae: 시크리키 채팅창에 친 거.\nJason Hwang: 아이고 이거 그렇게 막 공유해 주지만네 일단은\nIrene Bae: 아, 그래요? 어. 어.\nJason Hwang: 일단은 그거 한번 되는지 한번 어 설정을 해 보시겠어요?\nIrene Bae: 아, 그 아, 제가 그래서이 키를 가지고 아까 그 뭐 링크 주셨잖아요.\nJason Hwang: 네.\nIrene Bae: 그거 따라서 하면은 이제 그런 거 안 뜰 거라고 하셨는데 잠시만요. 제가 아, 어디 찌 있네 여기서? 어, 네. 아, 잠시만요. 이거를 음. 잠시만요. 이게 그래서 어 제 거 터미널이 어디 갔지? 아 여기 있다. 여기 있다. 아 그래서 여기서 지금 진나님 거를\nJason Hwang: 네.\n \n \n00:05:05\n \nIrene Bae: 따라하면 되는 건지 아 태원 님 거야?\nJason Hwang: 아, 태우니 거. 태우니까요.\nIrene Bae: 근데 여기서\nJason Hwang: 예.\nIrene Bae: 어이\nJason Hwang: 네.\nIrene Bae: 어추얼 키셀렉션 모델. 그 1번 모르겠어요, 스님.\nJason Hwang: 아, 저런 거 TV 하나 있는데 뭐가 올라오는데 모르겠잖아요.\nIrene Bae: 네. 예.\nJason Hwang: 저걸 복사해 가지고 그 커서나 안티그라 그라비티\nIrene Bae: 예.\nJason Hwang: 설치되셨어요?\nIrene Bae: 아니요. 아예이 안 돼 있을걸요.\nJason Hwang: 어 그러면 이제\nIrene Bae: 아니면 AI한테 물어보는 봐도 되긴 하\nJason Hwang: 안티그라비티나 커서 같은 거 설치해 놓으면은 걔네도 이제 그 클로드 코드처럼 뭐 저런 기능들이 좀 들어가 있어요. 이제 그래서 복사에서 붙여 놓으면은 걔네들이 해 줘요.\nIrene Bae: 네.\nJason Hwang: 무슨 말인지 무슨 말인지 모르겠는 것도 해 줘 가지고 그래서 이제 굳이 이렇게\nIrene Bae: 네.\n \n \n00:06:06
bf0090d95def	2026-02-02	2026/02/02 13:24 KST에 시작한 회의 - Gemini가 작성한 회의록	2	d1bfdbfb9a3e0499f9de08aa17603fe7ec5ec465	4573	7186	 뭐 저런 기능들이 좀 들어가 있어요. 이제 그래서 복사에서 붙여 놓으면은 걔네들이 해 줘요.\nIrene Bae: 네.\nJason Hwang: 무슨 말인지 무슨 말인지 모르겠는 것도 해 줘 가지고 그래서 이제 굳이 이렇게\nIrene Bae: 네.\n \n \n00:06:06\n \nJason Hwang: 설치법 그 것까지 설치법까지 아니 포함을 시켜 놓은게 웬만한 이제 안 되는 것들은 어 이제 물어보면 알려 줘요.\nIrene Bae: 네.\nJason Hwang: 걔가 이렇게이 AI 기능이\nIrene Bae: 아, 약간 AI 같은 거네요, 그러면.\nJason Hwang: 내장된 그런 편집기거든요. 일종에 그래서 이제 걔네한테 물어보신 이제 저렇게\nIrene Bae: 아,\nJason Hwang: 되면은네 물어보시는 것도\nIrene Bae: 네.\nJason Hwang: 방법입니다.\nIrene Bae: 어, 알겠습니다.\nJason Hwang: 예. 아니면 이제 그 그냥 간단하게 말씀드리면은 어 텀 그냥 클로드 코드 저기서\nIrene Bae: 네.\nJason Hwang: 나가셔서 그 클로드 코드네 컨터네\nIrene Bae: 클로드를 나가요.\nJason Hwang: 거기서 아마 저기 뭐야 맥이라고 하셨죠? 맥이면은 그거 뭐지?\nIrene Bae: 네.\nJason Hwang: 커맨드 키랑 C 누르면은 그 나가 나가지실 거예요.\nIrene Bae: 네.\nJason Hwang: 한 두 두 세 번 누르면은 클릭하고 커맨드 C\nIrene Bae: 안\nJason Hwang: 어 안 되면은 그냥 커맨드랑 T키 T가 딘가 눌러 보시겠어요?\n \n \n00:07:12\n \nJason Hwang: 그랜드 T.\nIrene Bae: 커맨드 T.\nJason Hwang: 네. 네.\nIrene Bae: 어,\nJason Hwang: 그럼 세탭으로 넘어가는데 그러면 이제 음령어들\nIrene Bae: 네.\nJason Hwang: 있잖아요. 엑스포트 해 갖고 앤티엔트로픽 베이스 URL 하고 네.\nIrene Bae: 아, 네.\nJason Hwang: 복사해 그니까 하나씩 하나씩 해 주는게 좋을 것 같아요. API 그 API.ai 톡화막 네트워크부터 복사하시고 네.\nIrene Bae: 아, 여기서부터\nJason Hwang: 위네 위에 거부터 하시고 하나 복사하시고 그네 위에 거 복사하시면 돼요.\nIrene Bae: 이거요.\nJason Hwang: 그 다 예 익스포트부터 끝까지 다 엔트로픽네\nIrene Bae: 아,요\nJason Hwang: 그렇죠 그리고 이제 그 밑에 거 복사하시는데 그리고 저 뉴얼 버추얼 키라고 돼 있잖아요.\nIrene Bae: 네.\nJason Hwang: 그 부분에다가 저 키를 넣으시면 돼요.\nIrene Bae: 아, 제 거 API요.\nJason Hwang: 네.\nIrene Bae: 아, 그러면\nJason Hwang: 지우고 저 유월 버추 키 있는 부분 지우고 이제 아이 아 아이린니 키를 넣으시면 아 그리고 그냥 싹 지우고 토큰부터 하시면 돼요.\n \n \n00:08:19\n \nIrene Bae: 어,\nJason Hwang: 토큰부터 싹 쌍 다운표 놓고 그러니까 엑스포트 엔트로픽\nIrene Bae: 네.\nJason Hwang: 토큰 사하시고네지 끝까지 지워주 지워서네 거기 어 좀 더 지우시고 아니 아니 거기 그렇게 뭐죠 그 달러 표시 있는 데까지 지우셔야 돼요 달라 표시네 그 옆에\nIrene Bae: 아, 요기요.\nJason Hwang: 또 그 중괄로도 있잖아요. 중로도 같이 지워 주시고요.\nIrene Bae: 네.\nJason Hwang: 네. 그리고 복사 뛰고 네.\nIrene Bae: 다운풍 다운표까지 냅두는 거죠.\nJason Hwang: X 그리고 뒤에서 다운표 하나 붙여야 돼요.\nIrene Bae: 아,\nJason Hwang: 네.\nIrene Bae: 요렇게.\nJason Hwang: 그렇게 하고 입력하시고 네. 그다음에 이제 영령을 저거 네. 그렇게 복사해서 실행해 주시고. 네. 그래서 저 밑에 밑에 클로드 모델 뭐 이렇게 클로드포스 4. 이렇게 돼 있죠. 예.\nIrene Bae: 이것도 복사 붙여 넣기면\nJason Hwang: 네.\n \n \n00:09:29\n \nJason Hwang: 그럼 이제 실행이 될 거거든요. 그리고이 된 건가?\nIrene Bae: 아\nJason Hwang: 어\nIrene Bae: 엔터 누르면\nJason Hwang: 한번 이제 엔턴 넣으면 어 모드가 바뀔 거고. 음. 네. 그냥 엔터 누르시면 될 거 같고요. 어 수면 될 거\nIrene Bae: 르면 되죠.\nJason Hwang: 같아요. 네. 됐네요. 이제 그리고 하시면 되거든.\nIrene Bae: 그러면요 앞전에 있었던요 페이지는\nJason Hwang: 그냥 그냥 꾸시면 될 거 같아. 저기 X 그 엑스표 있잖아. 네.\nIrene Bae: 아네\nJason Hwang: 무시하셔도 될 거 같고 이렇게 하면 될 텐데 아마 지금 작업도 좀 폴더 구분해서 하면 좋잖아요. 아마 지금 그냥 기본 폴더여서 이제 바로 하지 바로 하시지 마시고\nIrene Bae: 네.\nJason Hwang: 그 뭐 워크스페이스라든지 이런 거 만들어서 그 안에서 작업하시면 좋을 거\nIrene Bae: 네.\nJason Hwang: 같거든요. 네. 네.\nIrene Bae: 네.\n \n \n00:10:41
bf0090d95def	2026-02-02	2026/02/02 13:24 KST에 시작한 회의 - Gemini가 작성한 회의록	3	d82609665a7cd5c35b8e169173e5bd227f7a39ab	7036	9659	바로 하지 바로 하시지 마시고\nIrene Bae: 네.\nJason Hwang: 그 뭐 워크스페이스라든지 이런 거 만들어서 그 안에서 작업하시면 좋을 거\nIrene Bae: 네.\nJason Hwang: 같거든요. 네. 네.\nIrene Bae: 네.\n \n \n00:10:41\n \nJason Hwang: 그 지금 당장 하시지 마시고 그냥 여기서 exit 누르면 EXIT 타이핑하면은 나가지거든요.\nIrene Bae: 아, 알겠습니다.\nJason Hwang: 여기서\nIrene Bae: 그러면은 제가 만약에 이걸 다시 열고 싶을 때는 터미널에다가 터미널 열면 바로\nJason Hwang: 네.\nIrene Bae: 얘가 뜨나요?\nJason Hwang: 아, 아니 그 아까 그 클로드 모델 클로드 4.5 있잖아요. 이거 해 주셔야죠.\nIrene Bae: 네. 아, 이거 요거요?\nJason Hwang: 네. 네. 그렇게 해서 실행을 하는 거예요. 저게 어쨌든 클로드 치면은 실행이 되는 거고 뒤에 모델 붙는 거는 이제 모델을 딱\nIrene Bae: 아, 네.\nJason Hwang: 그 특정 짓는 거거든요.\nIrene Bae: 아.\nJason Hwang: 네. 그런 식으로 하시면 될 거\nIrene Bae: 아, 감사합니다.\nJason Hwang: 같아요.\nIrene Bae: 스님. 스님 혹시 이거 API 키가 털리면은 뭐 어떻게 되나요?\nJason Hwang: 어, 그냥 폐기하고 새로 만드시면 돼요.\n \n \n00:11:29\n \nIrene Bae: 아. 아,\nJason Hwang: 그러니까 지금 전 네.\nIrene Bae: 근데 이거 아, 네. 아, 근데 뭐 쓰님,\nJason Hwang: 이거 이미 아,\nIrene Bae: 저는 쓰님 믿어서 뭐 굳이 상관없는데.\nJason Hwang: 네. 그거 상관없는데 이제 되면은 뭐죠?\nIrene Bae: 네.\nJason Hwang: 이거 올라가지 않나요? 채팅까지 올라가지 않나요? 상관없네.\nIrene Bae: 그건 그건 맞아요.\nJason Hwang: 네. 올라가면은 이제 네. 공개된 거죠.\nIrene Bae: 아,\nJason Hwang: 그러면 제가 문제가 아니라\nIrene Bae: 근데 이것 때문에 이것때 이거 API 키를 알게 되면 혹시나\nJason Hwang: 네. 네.\nIrene Bae: 뭐 메타마스크가 털린다거나\nJason Hwang: 메타마스크나 털린다거나 그러진 않은데 이제 그럴 수 있어요.\nIrene Bae: 그\nJason Hwang: 이제 만약에 저 키 털려 갖고 뭐 갑자기 저쪽 서버에 공격 들어간다 그러면 이제 갑자기 누가 있냐?\nIrene Bae: 응. 응.\nJason Hwang: 뭐가 문제냐?\n \n \n00:12:09\n \nIrene Bae: 응.\nJason Hwang: 이제 캐빈이 추궁 들어올 수 있죠.\nIrene Bae: 아. 어.\nJason Hwang: 네. 그런게 좀 있습니다.\nIrene Bae: 아, 알겠습니다.\nJason Hwang: 네. 그래서 그냥 네. 한번 좀 알아보실 경로 하나 만드실까요?\nIrene Bae: 알겠습니다.\nJason Hwang: 그러면은 지금 그 뒤에 라이트램 그 페이지 떠 있잖아요. 네.\nIrene Bae: 네.\nJason Hwang: 거기서 아마 지금 보니까 그냥 새로 만들 수도 있는 거 같아서 저 크레트 유키 해 가지고 네.\nIrene Bae: 네.\nJason Hwang: 밑에 건 괜찮 키 네임 그냥 그거 괜찮고 그냥 더 아래에 키 키 디테일 있죠?\nIrene Bae: 네.\nJason Hwang: 팀 팀 팀까지는 뭐 안 해도 되는 거 같은데.\nIrene Bae: 아, 안 네.\nJason Hwang: 예. 아래 키네임 적당히 하시고 네.\nIrene Bae: 네.\nJason Hwang: 그리고 밑에 거에 어 아까 세팅 오퍼스로 해 놨으니까 쭉 내리다 보면 클러 클러드 오퍼스 4.5\nIrene Bae: 클로드 아, 여기 있다.\nJason Hwang: 네거 클릭하시고 일단 크리에이트 만들어 보시죠.\n \n \n00:13:14\n \nIrene Bae: 네.\nJason Hwang: 어 하셔도 될 거 같고 크리에트 키 해 보시면 될 거 같아.\nIrene Bae: 아, 요걸로 쓰면 되겠네요.\nJason Hwang: 카피네\nIrene Bae: 그리고 그러면 아까 제 거 터미널에서\nJason Hwang: 터미널에서 아 나가셔서 여기서 ex 쳐 보세요. 어 그전에 그 뭐죠?\nIrene Bae: X요.\nJason Hwang: 히 뭐 저한 그 메모장 같은데 잠깐 복사해 두셨다가요. 한번 또 그거 뭐죠? 태우님이 오 주신 익스포트 그거 해야 되거든요. 네.\nIrene Bae: 아, 여기서 이거\nJason Hwang: 아니요.\nIrene Bae: 다시 하면 될거\nJason Hwang: URL까지 말고 어 밑에 거 그 두 번째 건 첫 번째 건 괜찮고 두 번째 거 예 그냥\nIrene Bae: 아, 이거 아,\nJason Hwang: 토큰까지만 복사하시는게 편할 거 같아요.\nIrene Bae: 네.\nJason Hwang: 다음 화면은 또 지워야 되니까. 네.\nIrene Bae: 다운표까지만\nJason Hwang: 타운표까지 해서 복수 붙여 놓고 네.\nIrene Bae: 그리고 제거키\nJason Hwang: 그리고 키 키 다시\nIrene Bae: 누르면\n \n \n00:14:33
bf0090d95def	2026-02-02	2026/02/02 13:24 KST에 시작한 회의 - Gemini가 작성한 회의록	4	1311d0717d07e5353545ad60df625b5587667220	9509	11464	Hwang: 다음 화면은 또 지워야 되니까. 네.\nIrene Bae: 다운표까지만\nJason Hwang: 타운표까지 해서 복수 붙여 놓고 네.\nIrene Bae: 그리고 제거키\nJason Hwang: 그리고 키 키 다시\nIrene Bae: 누르면\n \n \n00:14:33\n \nJason Hwang: 바꾼데네\nIrene Bae: 여기서 이렇게 엔터\nJason Hwang: 그리고 수상 덮대 그리고 이제 아까 밑에 그 소스해서 스티치는 명령하 그 하나 있었거든요. 아마 그 지금 아 여기서요 아 그냥 터미널 클릭해서 하하셔\nIrene Bae: 네\nJason Hwang: 가지고 방향 위 뭐죠? 위로하는 방 화살표 있죠? 위 화살표 위쪽으로 이렇게네 그냥 그 터미널\nIrene Bae: 화살표 위쪽\nJason Hwang: 클릭해서 터미널 화면 클릭하고 대충 화살표 이쪽 아무거나 눌러 보세요. 화살표 이쪽 위쪽 화살표 있지 않나요? 아니요. 그냥 마우스로 말고 마우스로는 그냥 화면 클릭해서 이제 커스 놓으시고 네.\nIrene Bae: 네.\nJason Hwang: 클릭했으면은 그다음에 화살표 위쪽 눌러 보세요.\nIrene Bae: 어. 어. 어떤\nJason Hwang: 화살표 위쪽 화살표 있잖아.\nIrene Bae: 거요?\nJason Hwang: 그 저전후자우 있잖아요. 그 화살표 그 키보드에 아 키보드 키보드 제가 말씀드 잘 제못드는 예\n \n \n00:15:36\n \nIrene Bae: 이거요? 아.\nJason Hwang: 키보드 쪽 눌러 보세요.\nIrene Bae: 모은네\nJason Hwang: 이렇게 더 올려 보시면은 명령어가 있을 거거든요.네 이렇게 하셔도 되고요.\nIrene Bae: 요거 아네 그 요거 누르고 또 엔터\nJason Hwang: 네.\nIrene Bae: 누르면 되죠 그리고 마지막에 이거 클로드 클로드 모델\nJason Hwang: 네.\nIrene Bae: 오프스\nJason Hwang: 그것도 했던게 있으니까 해도 되고.\nIrene Bae: 이렇게.\nJason Hwang: 네.\nIrene Bae: 아 그러면은 이제 된\nJason Hwang: 네. 네.\nIrene Bae: 건가요?\nJason Hwang: 그리고 어 뭐 간단하게 뭐라고 해야 될까요? 그냥 간단 명령 하나 명령 하나 쳐 보세요.\nIrene Bae: 네.\nJason Hwang: 저렇게 어 탭 눌러 보시면은 그냥 거기서 탭 눌러\nIrene Bae: 어.\nJason Hwang: 보세요. 예. 누르면 안 되나? 그 간단하게 그냥 뭐 간단하게 뭐 프로젝트 폴더 하나 만들어지죠. 이런 식으로 명령하 하나 날려 보시면 될 거 같거든요. 거기다가.\n \n \n00:16:47\n \nIrene Bae: 이거 스님이 만들어 주신 거에서 봤어요.\nJason Hwang: 음.요\nIrene Bae: 뭐 뭐 어 아\nJason Hwang: 요 밑에 사용 예시 밑에 있네요. 거기 파이썬으로 1부터 10까지 더\nIrene Bae: 네좀게음네\nJason Hwang: 정게 하시면은 잘 됐는지 안 되는지 확인할 수 있을 것 같아요. 일단은 잘 되는 거 같긴 하거든요.\nIrene Bae: 어,\nJason Hwang: 네.\nIrene Bae: 잘 된 거 같은데,\nJason Hwang: 잘 되네요. 네,\nIrene Bae: 스님.\nJason Hwang: 잘 된 거 같습니다.\nIrene Bae: 와우, 감사합니다.\nJason Hwang: 음.\nIrene Bae: 스님.\nJason Hwang: 아, 도움이 됐다니 다행입니다.\nIrene Bae: 너무 도움이 됐습니다. 스님, 전어 리뷰를 작성하러가 보겠습니다.\nJason Hwang: 음.\nIrene Bae: 아, 진짜. 아, 감사합니다, 스님.\nJason Hwang: 네. 원.\nIrene Bae: 그러면 저는 이거 만약에 안 쓸 때는 엑시으로 해서 이렇게 해서\nJason Hwang: 네. 네.\nIrene Bae: 나가고 그다음에 제가 이거 X를 눌러서 끌 거\n \n \n00:17:49
bf0090d95def	2026-02-02	2026/02/02 13:24 KST에 시작한 회의 - Gemini가 작성한 회의록	5	50734a3a15baa27891443922b377b81a0ea7f069	11314	12568	. 아, 감사합니다, 스님.\nJason Hwang: 네. 원.\nIrene Bae: 그러면 저는 이거 만약에 안 쓸 때는 엑시으로 해서 이렇게 해서\nJason Hwang: 네. 네.\nIrene Bae: 나가고 그다음에 제가 이거 X를 눌러서 끌 거\n \n \n00:17:49\n \nJason Hwang: 네.\nIrene Bae: 아니에요.\nJason Hwang: 네.\nIrene Bae: 그리고 만약에 제가 터미널을 다시 열고 싶다 그러면은 이렇게 해 가지고 터미널 이렇게 열 다음에\nJason Hwang: 네.\nIrene Bae: 여기서\nJason Hwang: 클로드 해도 하시면 될 거 같고요. 클로드 아까 그 모델 제정에서\nIrene Bae: 아 이거 이거\nJason Hwang: 네.\nIrene Bae: 해서 클릭하면 어 아 바로 뜨네요.\nJason Hwang: 음. 네. 네. 어.\nIrene Bae: 오,\nJason Hwang: 어 미싱키 아 저러면은 저러면 저거 저저런\nIrene Bae: 네.에에\nJason Hwang: 거 뜰 때 미싱 AP라고 써 있잖아요. 밑에 빨간색으로 그 우 우 우측하단에 그럴 때는 이제 나가셔서\nIrene Bae: 에에\nJason Hwang: 다시 저 소스 명령어 있죠?네 네.\nIrene Bae: 나가요. 일단 엑\nJason Hwang: 엑시해 갖고 소스 명령을 치고 다시 하면 되실 거예요.\nIrene Bae: 소스 명령어는 이거 클로드 이거 아 소스\nJason Hwang: 아니요. 그 위에 거 3번 3번 명령을 네.\nIrene Bae: 이거 요거\nJason Hwang: 아, 저것도 같이 넣어 놔야겠네요.\nIrene Bae: 누르면\nJason Hwang: 하고 다시 한번 해 보시겠어요? 그 네. 그 키보드 화살표 두 번 위로 눌러 보시면 있을 거예요. 저 왜 미싱지?\nIrene Bae: TR,\nJason Hwang: 한번 그냥 똑같은 명령 한번 다시 날려 보시겠어요? 그 하이썬 그거 아무 복 지금 복사한게 없으셔서 있을 것 같긴 한데 다시 부여놓게 해 보시면은네 그 아까 파이썬\nIrene Bae: 잠시만요. 어, 헷갈려요. 어떤 거 붙여 놓게 하면 되는 거죠?\nJason Hwang: 명령어 있었잖아요 아마네 그거 다시 한번 해\nIrene Bae: 아, 8성.\nJason Hwang: 보시면은음\n \n \n00:20:20 후 스크립트 작성이 종료되었습니다.\n\n수정 가능한 이 스크립트는 컴퓨터에서 생성되었으며 오류가 포함되어 있을 수 있습니다. 생성 후에도 사용자가 텍스트를 변경할 수 있습니다.
